{"dataset":"bridges","api_version":"v1","schema_version":"1.1.0","schema_url":"https://blockchains.github.io/blockchainlab-api/v1/schemas/bridges.schema.json","description":"Cross-chain and canonical bridges ranked by TVL (DefiLlama bridge categories).","generated_at":"2026-10-28T09:42:55.117Z","source":"DefiLlama protocols (bridge categories)","source_url":"https://api.llama.fi/protocols","built_by":"Blockchain Lab — https://blockchainlab.com","licence_note":"Data belongs to the named source; check its terms before reuse. Attribute the source and Blockchain Lab.","count":251,"data":[{"rank":1,"name":"LayerZero V2","slug":"layerzero-v2","category":"Bridge","chains":["Polygon","Ethereum","ApeChain","Arbitrum","Base","Solana","Binance","Tron","Flare","Plasma","Stable","Citrea","Hyperliquid L1","Abstract","Gensyn","Peaq","Somnia","Hemi","Fraxtal","Kava","Avalanche","TAC","0G","zkSync Era","Sei","Fantom","Optimism","Chiliz","Metis","Goat","Celo","Telos","RSK","Robinhood Chain","Mantle","Katana","Blast","Linea","Cronos","Unichain","Soneium","Berachain","Ink","Scroll","Vana","Sonic","Flow","Conflux","Redbelly","Astar","Mode","Story","CORE","Manta","Plume Mainnet","xDai","XDC","LightLink","Monad","XPLA","Tempo","X Layer","Morph","Swellchain","Taiko","BOB","Canto","World Chain","Hedera","Op_Bnb","Moonriver","Lisk","MegaETH","Harmony","Degen","Moonbeam","Polygon zkEVM","Zora","Sophon","Ethereal","Etherlink","Codex","KiteAI","TomoChain","Rayls","Apex Fusion","Irys","zkVerify","Bittensor EVM","Klaytn","Nibiru"],"tvl_usd":16821449471,"change_7d_pct":5.761220604070445,"url":"https://layerzero.network/","audits":"2","defillama_url":"https://defillama.com/protocol/layerzero-v2"},{"rank":2,"name":"WBTC","slug":"wbtc","category":"Bridge","chains":["Bitcoin"],"tvl_usd":9412581090,"change_7d_pct":-2.1773711080509486,"url":"https://wbtc.network/","audits":"2","defillama_url":"https://defillama.com/protocol/wbtc"},{"rank":3,"name":"Coinbase Bridge","slug":"coinbase-bridge","category":"Bridge","chains":["Bitcoin","Ripple","Cardano","Doge","Litecoin"],"tvl_usd":7974177493,"change_7d_pct":-1.2177697983487406,"url":"https://www.coinbase.com/","audits":"0","defillama_url":"https://defillama.com/protocol/coinbase-bridge"},{"rank":4,"name":"Hyperliquid Bridge","slug":"hyperliquid-bridge","category":"Bridge","chains":["Hyperliquid L1","Arbitrum"],"tvl_usd":6610332309,"change_7d_pct":-1.8276967338134256,"url":"https://app.hyperliquid.xyz","audits":"2","defillama_url":"https://defillama.com/protocol/hyperliquid-bridge"},{"rank":5,"name":"Binance Bitcoin","slug":"binance-bitcoin","category":"Bridge","chains":["Bitcoin"],"tvl_usd":5509631066,"change_7d_pct":-2.1773710693235415,"url":"https://www.binance.com/en/collateral-btokens","audits":"0","defillama_url":"https://defillama.com/protocol/binance-bitcoin"},{"rank":6,"name":"Arbitrum Bridge","slug":"arbitrum-bridge","category":"Canonical Bridge","chains":["Ethereum"],"tvl_usd":3311248780,"change_7d_pct":-2.7721419171401465,"url":"https://portal.arbitrum.io/bridge","audits":"2","defillama_url":"https://defillama.com/protocol/arbitrum-bridge"},{"rank":7,"name":"USDT0","slug":"usdt0","category":"Bridge","chains":["Ethereum"],"tvl_usd":3205251374,"change_7d_pct":2.742079034200188,"url":"https://usdt0.to","audits":"2","defillama_url":"https://defillama.com/protocol/usdt0"},{"rank":8,"name":"Base Bridge","slug":"base-bridge","category":"Canonical Bridge","chains":["Ethereum"],"tvl_usd":2889847530,"change_7d_pct":-3.415570243028071,"url":"https://docs.base.org/base-chain/network-information/bridges-mainnet","audits":"0","defillama_url":"https://defillama.com/protocol/base-bridge"},{"rank":9,"name":"Polygon Bridge","slug":"polygon-bridge","category":"Canonical Bridge","chains":["Ethereum"],"tvl_usd":2665276739,"change_7d_pct":-1.204898764124053,"url":"https://polygon.technology/","audits":"0","defillama_url":"https://defillama.com/protocol/polygon-bridge"},{"rank":10,"name":"JustCryptos","slug":"justcryptos","category":"Bridge","chains":["Tron"],"tvl_usd":2570504964,"change_7d_pct":-3.014080260124203,"url":"https://just.network/token","audits":"0","defillama_url":"https://defillama.com/protocol/justcryptos"},{"rank":11,"name":"CCIP","slug":"ccip","category":"Bridge","chains":["Ethereum","Solana","Avalanche","Base","Hyperliquid L1","Arbitrum","Ronin","Bittensor EVM","Optimism","Pharos","Binance","BOB","0G","World Chain","Astar","zkSync Era","Polygon","Linea","HashKey Chain","Sonic","Shibarium"],"tvl_usd":2007858678,"change_7d_pct":0.6995581415149701,"url":"https://chain.link/cross-chain","audits":"0","defillama_url":"https://defillama.com/protocol/ccip"},{"rank":12,"name":"Portal","slug":"portal","category":"Bridge","chains":["Ethereum","Algorand","Binance","Solana","Near","Polygon","Avalanche","Sui","Base","Arbitrum","Optimism","Aptos","Celo","Klaytn","Terra","Oasis","Aurora","Fantom","Karura","Acala","Moonbeam","Terra2","Injective","XPLA"],"tvl_usd":1514371077,"change_7d_pct":-5.239954168698034,"url":"https://portalbridge.com","audits":"2","defillama_url":"https://defillama.com/protocol/portal"},{"rank":13,"name":"Unit","slug":"unit","category":"Bridge","chains":["Bitcoin","Zcash","Ethereum","Solana","Plasma","Monad","Base","Avalanche"],"tvl_usd":971382465,"change_7d_pct":-1.3059938968611675,"url":"https://hyperunit.xyz/deposit","audits":"0","defillama_url":"https://defillama.com/protocol/unit"},{"rank":14,"name":"Kraken Bitcoin","slug":"kraken-bitcoin","category":"Bridge","chains":["Bitcoin"],"tvl_usd":766102494,"change_7d_pct":-2.2108724763866263,"url":"https://www.kraken.com/kbtc","audits":"0","defillama_url":"https://defillama.com/protocol/kraken-bitcoin"},{"rank":15,"name":"Function FBTC","slug":"function-fbtc","category":"Bridge","chains":["Bitcoin"],"tvl_usd":668478881,"change_7d_pct":-1.3726562075415671,"url":"https://www.fxn.xyz","audits":"0","defillama_url":"https://defillama.com/protocol/function-fbtc"},{"rank":16,"name":"Optimism Bridge","slug":"optimism-bridge","category":"Canonical Bridge","chains":["Ethereum","Base","PGN"],"tvl_usd":640469325,"change_7d_pct":-24.928710424866523,"url":"https://app.optimism.io/bridge/deposit","audits":"0","defillama_url":"https://defillama.com/protocol/optimism-bridge"},{"rank":17,"name":"Robinhood Chain Bridge","slug":"robinhood-chain-bridge","category":"Canonical Bridge","chains":["Ethereum"],"tvl_usd":618482563,"change_7d_pct":-4.322109808955403,"url":"https://robinhood.com/us/en/chain/","audits":"0","defillama_url":"https://defillama.com/protocol/robinhood-chain-bridge"},{"rank":18,"name":"Lighter Bridge","slug":"lighter-bridge","category":"Bridge","chains":["Ethereum","Arbitrum"],"tvl_usd":601096910,"change_7d_pct":-0.8023768027876201,"url":"https://app.lighter.xyz","audits":"0","defillama_url":"https://defillama.com/protocol/lighter-bridge"},{"rank":19,"name":"Aster Bridge","slug":"aster-bridge","category":"Bridge","chains":["Binance","Ethereum","Arbitrum","Solana","Scroll"],"tvl_usd":531659155,"change_7d_pct":7.135849452046656,"url":"https://www.asterdex.com","audits":"0","defillama_url":"https://defillama.com/protocol/aster-bridge"},{"rank":20,"name":"SolvBTC","slug":"solvbtc","category":"Bridge","chains":["Bitcoin","Binance","Ethereum","Solana","Base","Arbitrum","X Layer","Mantle","Polygon","Merlin","Avalanche","BOB"],"tvl_usd":496156946,"change_7d_pct":-5.297835896958858,"url":"https://app.solv.finance/solvbtc","audits":"0","defillama_url":"https://defillama.com/protocol/solvbtc"},{"rank":21,"name":"Lorenzo enzoBTC","slug":"lorenzo-enzobtc","category":"Bridge","chains":["Bitcoin"],"tvl_usd":486667007,"change_7d_pct":-2.177462101619483,"url":"https://www.lorenzo-protocol.xyz","audits":"0","defillama_url":"https://defillama.com/protocol/lorenzo-enzobtc"},{"rank":22,"name":"Merlins Seal","slug":"merlins-seal","category":"Bridge","chains":["Bitcoin","Ethereum","Arbitrum","Zkfair"],"tvl_usd":426902663,"change_7d_pct":-2.1974862852711965,"url":"https://merlinchain.io/bridge/staking","audits":"0","defillama_url":"https://defillama.com/protocol/merlins-seal"},{"rank":23,"name":"World Chain Bridge","slug":"world-chain-bridge","category":"Canonical Bridge","chains":["Ethereum"],"tvl_usd":382364356,"change_7d_pct":-24.53859679396679,"url":"https://world.org/","audits":"0","defillama_url":"https://defillama.com/protocol/world-chain-bridge"},{"rank":24,"name":"Nexus BTC","slug":"nexus-btc","category":"Bridge","chains":["Bitcoin"],"tvl_usd":363871116,"change_7d_pct":20.579747775251818,"url":"https://www.bit.com/","audits":"0","defillama_url":"https://defillama.com/protocol/nexus-btc"},{"rank":25,"name":"Starknet Bridge","slug":"starknet-bridge","category":"Canonical Bridge","chains":["Ethereum"],"tvl_usd":266568755,"change_7d_pct":-10.91965508584245,"url":"https://starkgate.starknet.io","audits":"0","defillama_url":"https://defillama.com/protocol/starknet-bridge"},{"rank":26,"name":"xDAI Stake Bridge","slug":"xdai-stake-bridge","category":"Canonical Bridge","chains":["Ethereum"],"tvl_usd":254664322,"change_7d_pct":-3.186645425425624,"url":"https://www.gnosis.io/","audits":"2","defillama_url":"https://defillama.com/protocol/xdai-stake-bridge"},{"rank":27,"name":"Linea Bridge","slug":"linea-bridge","category":"Canonical Bridge","chains":["Ethereum"],"tvl_usd":230557863,"change_7d_pct":-9.313547341884643,"url":"https://bridge.linea.build","audits":"0","defillama_url":"https://defillama.com/protocol/linea-bridge"},{"rank":28,"name":"NEAR Intents","slug":"near-intents","category":"Bridge","chains":["Near","Ethereum","Tron","Bitcoin","Binance","Arbitrum","Base","Polygon","Ripple","xDai","Litecoin","TON","Doge","Avalanche","Optimism","Dash","Sui","Monad","Cardano","Solana","Stellar","Berachain","X Layer","ADI","Aurora","Aptos"],"tvl_usd":207923404,"change_7d_pct":-4.395266071624221,"url":"https://near.com/","audits":"0","defillama_url":"https://defillama.com/protocol/near-intents"},{"rank":29,"name":"Stacks sBTC","slug":"stacks-sbtc","category":"Bridge","chains":